{"schema_version":"1.0.0","dataset":"jobs","generated_at":"2026-10-16T19:52:21.425393Z","run_id":"38957968894-1","data_window":{"start":"2026-09-16","end":"2026-10-16"},"coverage":{"sources":[{"source":"gupy","status_last_run":"ok","last_success_at":"2026-10-16T19:52:18.878522Z","records_last_run":244,"jobs_in_history":249}],"observations":46,"note":"Amostra das fontes e termos configurados no JobRadar; não representa o mercado inteiro. Tendências consideram o volume coletado por período."},"data":{"selection":{"window_days":30,"limit":300,"total_relevant":46,"sort":"published_at_desc","criteria":"famílias de dados, senioridade e modalidade/local conforme config/sources.yaml"},"items":[{"id":"487daeb0b11baf6613b280a62a850bc5e0186f78","title":"ENGENHEIRO DADOS PL","company":"Stefanini Group","city":null,"state":null,"modality":"remoto","seniority":"pleno","family":"engenharia_dados","source":"gupy","url":"https://stefanini.gupy.io/job/eyJqb2JJZCI6MTI3MzE2MTEsInNvdXJjZSI6Imd1cHlfcG9ydGFsIn0=?jobBoardSource=gupy_portal","published_at":"2026-10-16T18:11:03.252000Z","first_seen_at":"2026-10-16T18:20:30.393831Z","last_seen_at":"2026-10-16T19:52:06.627576Z","status":"ativa","skills":["airflow","aws","data_lake","data_warehouse"],"required_skills":["airflow","aws","data_lake","data_warehouse"]},{"id":"e65461b6f8909184b01a6913eae3654d4eee2837","title":"Analista de Dados","company":"Volkswagen Group Services South America","city":"São Paulo","state":"SP","modality":"hibrido","seniority":"nao_informada","family":"analise_dados","source":"gupy","url":"https://vwgs-sam.gupy.io/job/eyJqb2JJZCI6MTI3Mzc2NjgsInNvdXJjZSI6Imd1cHlfcG9ydGFsIn0=?jobBoardSource=gupy_portal","published_at":"2026-10-16T14:45:16.686000Z","first_seen_at":"2026-10-16T18:20:30.393831Z","last_seen_at":"2026-10-16T19:52:06.627576Z","status":"ativa","skills":["aws","azure","gcp","governanca","looker_tableau","power_bi","python","sql"],"required_skills":[]},{"id":"0d72d97496a31c1d647c47d9f1428c1c2784044a","title":"Analista de Dados PL - Petz Holding","company":"Petz","city":"São Paulo","state":"SP","modality":"presencial","seniority":"pleno","family":"analise_dados","source":"gupy","url":"https://petz.gupy.io/job/eyJqb2JJZCI6MTI3MDMxNzMsInNvdXJjZSI6Imd1cHlfcG9ydGFsIn0=?jobBoardSource=gupy_portal","published_at":"2026-10-16T12:45:16.146000Z","first_seen_at":"2026-10-16T18:20:30.393831Z","last_seen_at":"2026-10-16T19:52:06.627576Z","status":"ativa","skills":["modelagem","power_bi","python","sql"],"required_skills":["modelagem","power_bi","python","sql"]},{"id":"a6ff8c7271286c1b1ffbc791e516c84445e94c2b","title":"Analista de Dados Pleno - São Paulo/SP","company":"EuroChem","city":"São Paulo","state":"SP","modality":"hibrido","seniority":"pleno","family":"analise_dados","source":"gupy","url":"https://carreiras.gupy.io/job/eyJqb2JJZCI6MTI2OTM3MTEsInNvdXJjZSI6Imd1cHlfcG9ydGFsIn0=?jobBoardSource=gupy_portal","published_at":"2026-10-16T11:52:27.573000Z","first_seen_at":"2026-10-16T18:20:30.393831Z","last_seen_at":"2026-10-16T19:52:06.627576Z","status":"ativa","skills":["modelagem","power_bi","qualidade_dados","sql"],"required_skills":[]},{"id":"f4e17fadceb7afdd2965b081862d6776f6f82983","title":"22522-Analista de Dados","company":"Hitss Brasil","city":"São Paulo","state":"SP","modality":"presencial","seniority":"nao_informada","family":"analise_dados","source":"gupy","url":"https://globalhitss.gupy.io/job/eyJqb2JJZCI6MTI1NTA0MTIsInNvdXJjZSI6Imd1cHlfcG9ydGFsIn0=?jobBoardSource=gupy_portal","published_at":"2026-10-13T22:28:45.684000Z","first_seen_at":"2026-10-16T18:20:30.393831Z","last_seen_at":"2026-10-16T19:52:06.627576Z","status":"ativa","skills":[],"required_skills":[]},{"id":"1ed31cb28c0720bba23be345d5a10c38a419dcd1","title":"Engenheiro(a) de Dados - DBT","company":"NCS","city":"São Paulo","state":"SP","modality":"hibrido","seniority":"nao_informada","family":"engenharia_dados","source":"gupy","url":"https://ncs.gupy.io/job/eyJqb2JJZCI6MTI3MTc5NTcsInNvdXJjZSI6Imd1cHlfcG9ydGFsIn0=?jobBoardSource=gupy_portal","published_at":"2026-10-13T18:46:57.965000Z","first_seen_at":"2026-10-16T18:20:30.393831Z","last_seen_at":"2026-10-16T19:52:06.627576Z","status":"ativa","skills":["aws","azure","cicd","data_lake","data_warehouse","databricks","dbt","etl","gcp","git","governanca","modelagem","python","qualidade_dados","snowflake","sql"],"required_skills":["aws","azure","cicd","data_lake","data_warehouse","databricks","dbt","etl","gcp","git","governanca","modelagem","python","qualidade_dados","snowflake","sql"]},{"id":"4a2bd0f67991d9fc6df0196c89f5daf1591aaf0b","title":"Analista de Dados Pleno - Legal Ops","company":"Lazzo Secondment","city":"São Paulo","state":"SP","modality":"presencial","seniority":"pleno","family":"analise_dados","source":"gupy","url":"https://lazzosecondment.gupy.io/job/eyJqb2JJZCI6MTI3MTQ4NzksInNvdXJjZSI6Imd1cHlfcG9ydGFsIn0=?jobBoardSource=gupy_portal","published_at":"2026-10-13T15:48:02.443000Z","first_seen_at":"2026-10-16T18:20:30.393831Z","last_seen_at":"2026-10-16T19:52:06.627576Z","status":"ativa","skills":["data_lake","databricks","power_bi"],"required_skills":["data_lake","databricks","power_bi"]},{"id":"2f361dae42c075dbf98da95a50ae1ca7081ad874","title":"Engenheiro de Dados","company":"Montreal | Tecnologia e Inovação","city":"Taboão da Serra","state":"SP","modality":"hibrido","seniority":"nao_informada","family":"engenharia_dados","source":"gupy","url":"https://montreal.gupy.io/job/eyJqb2JJZCI6MTI3MTU3NjcsInNvdXJjZSI6Imd1cHlfcG9ydGFsIn0=?jobBoardSource=gupy_portal","published_at":"2026-10-13T15:23:54.212000Z","first_seen_at":"2026-10-16T18:20:30.393831Z","last_seen_at":"2026-10-16T19:52:06.627576Z","status":"ativa","skills":["cicd","data_warehouse","etl","kafka","modelagem","python","spark","sql"],"required_skills":["cicd","data_warehouse","etl","kafka","modelagem","python","spark","sql"]},{"id":"679b5118679f9d270c0a1a6aabdce5b426cc9ae1","title":"Engenheiro de Dados","company":"+A Educação","city":null,"state":null,"modality":"remoto","seniority":"nao_informada","family":"engenharia_dados","source":"gupy","url":"https://maisaedu.gupy.io/job/eyJqb2JJZCI6MTI3MDc1NDgsInNvdXJjZSI6Imd1cHlfcG9ydGFsIn0=?jobBoardSource=gupy_portal","published_at":"2026-10-09T22:17:48.062000Z","first_seen_at":"2026-10-16T18:20:30.393831Z","last_seen_at":"2026-10-16T19:52:06.627576Z","status":"ativa","skills":["aws","data_lake","data_warehouse","dbt","etl","governanca","modelagem","postgres","python","qualidade_dados","snowflake","sql"],"required_skills":[]},{"id":"6b23e6d8c2833306d17171ba00641b147cbadba5","title":"Analista de Dados","company":"Gradus","city":"São Paulo","state":"SP","modality":"presencial","seniority":"nao_informada","family":"analise_dados","source":"gupy","url":"https://gradus.gupy.io/job/eyJqb2JJZCI6MTI3MDkzNTEsInNvdXJjZSI6Imd1cHlfcG9ydGFsIn0=?jobBoardSource=gupy_portal","published_at":"2026-10-09T21:05:24.790000Z","first_seen_at":"2026-10-16T18:20:30.393831Z","last_seen_at":"2026-10-16T18:41:12.550158Z","status":"ativa","skills":["etl","modelagem","power_bi","python","sql"],"required_skills":[]},{"id":"0a95f55062dd45b73fcbce861d9fd5e0ce743d0b","title":"Engenheiro de Dados JR (Vaga exclusivo para PCD)","company":"Ipiranga","city":null,"state":null,"modality":"remoto","seniority":"junior","family":"engenharia_dados","source":"gupy","url":"https://ipiranga.gupy.io/job/eyJqb2JJZCI6MTI3MDgxNjIsInNvdXJjZSI6Imd1cHlfcG9ydGFsIn0=?jobBoardSource=gupy_portal","published_at":"2026-10-09T19:21:57.930000Z","first_seen_at":"2026-10-16T18:20:30.393831Z","last_seen_at":"2026-10-16T19:52:06.627576Z","status":"ativa","skills":["aws","azure","cicd","data_factory","data_lake","databricks","etl","gcp","governanca","modelagem","power_bi","python","spark","sql"],"required_skills":["data_lake","databricks","etl","governanca","python","sql"]},{"id":"8424b011a1fd51496f69bfa45538394b350036f9","title":"Analista de Dados II (Pleno)","company":"Celk Sistemas","city":null,"state":null,"modality":"remoto","seniority":"pleno","family":"analise_dados","source":"gupy","url":"https://celksistemas.gupy.io/job/eyJqb2JJZCI6MTI3MDQ1NjMsInNvdXJjZSI6Imd1cHlfcG9ydGFsIn0=?jobBoardSource=gupy_portal","published_at":"2026-10-09T13:32:39.200000Z","first_seen_at":"2026-10-16T18:20:30.393831Z","last_seen_at":"2026-10-16T19:52:06.627576Z","status":"ativa","skills":["aws","data_lake","data_warehouse","etl","governanca","lgpd","looker_tableau","modelagem","power_bi","spark","sql"],"required_skills":["aws","data_lake","data_warehouse","etl","governanca","lgpd","looker_tableau","modelagem","power_bi","spark","sql"]},{"id":"160564c0f60e8592079953a9fe508bc8cb541967","title":"Engenheiro de Dados PL","company":"Grupo SysMap","city":null,"state":null,"modality":"remoto","seniority":"pleno","family":"engenharia_dados","source":"gupy","url":"https://gruposysmap.gupy.io/job/eyJqb2JJZCI6MTI2OTI4NzUsInNvdXJjZSI6Imd1cHlfcG9ydGFsIn0=?jobBoardSource=gupy_portal","published_at":"2026-10-08T20:18:44.121000Z","first_seen_at":"2026-10-16T18:20:30.393831Z","last_seen_at":"2026-10-16T19:52:06.627576Z","status":"ativa","skills":["data_lake","data_warehouse","docker","gcp","python"],"required_skills":[]},{"id":"5c50bdbfe59f4a34cfa3da92277caa5c0bb6401a","title":"Analista de Dados Jr - Área Financeira","company":"Motz","city":"São Paulo","state":"SP","modality":"hibrido","seniority":"junior","family":"analise_dados","source":"gupy","url":"https://motz.gupy.io/job/eyJqb2JJZCI6MTI3MDEwMzYsInNvdXJjZSI6Imd1cHlfcG9ydGFsIn0=?jobBoardSource=gupy_portal","published_at":"2026-10-08T19:21:30.544000Z","first_seen_at":"2026-10-16T18:20:30.393831Z","last_seen_at":"2026-10-16T19:52:06.627576Z","status":"ativa","skills":[],"required_skills":[]},{"id":"e937fbb92c49704d6da9530853cf3a8fb494fc9b","title":"ANALISTA DE DADOS JR (TEMPORÁRIO)- MOGI DAS CUZES","company":"Movida Aluguel de Carros","city":"Mogi das Cruzes","state":"SP","modality":"presencial","seniority":"junior","family":"analise_dados","source":"gupy","url":"https://movida.gupy.io/job/eyJq